Authors,Title,Year,Cited by,Link,Funding Details,Publication Stage
"Cao H., Bernard S., Sabourin R., Heutte L.","Random forest dissimilarity based multi-view learning for Radiomics application",2019,18,"https://www.scopus.com/inward/record.uri?eid=2-s2.0-85056856462&doi=10.1016%2fj.patcog.2018.11.011&partnerID=40&md5=14068009bbe9a1347e9e6a4fd9ab8058","European Commission

European Regional Development Fund

European Regional Development Fund","Final"
"Pontabry J., Rousseau F., Oubel E., Studholme C., Koob M., Dietemann J.-L.","Probabilistic tractography using Q-ball imaging and particle filtering: Application to adult and in-utero fetal brain studies",2013,18,"https://www.scopus.com/inward/record.uri?eid=2-s2.0-84875244113&doi=10.1016%2fj.media.2012.11.004&partnerID=40&md5=f1eeb20bcbf64f2fb5a475e770c29820","National Institutes of Health

National Institute of Neurological Disorders and Stroke

Seventh Framework Programme

European Research Council","Final"
"Kim E.J., Ordyniak S., Szeider S.","Algorithms and complexity results for persuasive argumentation",2011,18,"https://www.scopus.com/inward/record.uri?eid=2-s2.0-79955570152&doi=10.1016%2fj.artint.2011.03.001&partnerID=40&md5=b270254a69de19e4a3654463bc4636db","Seventh Framework Programme

Engineering and Physical Sciences Research Council

European Research Council","Final"
"Guétat G., Maitre M., Joly L., Lai S.-L., Lee T., Shinagawa Y.","Automatic 3-D grayscale volume matching and shape analysis",2006,18,"https://www.scopus.com/inward/record.uri?eid=2-s2.0-33645740763&doi=10.1109%2fTITB.2005.863875&partnerID=40&md5=95a83aab792e40c6cf80cee8670a8d80","National Science Foundation

National Institutes of Health

National Institute of Biomedical Imaging and Bioengineering

University of Illinois System","Final"
"Voultsidou M., Dodel S., Herrmann J.M.","Neural networks approach to clustering of activity in fMRI data",2005,18,"https://www.scopus.com/inward/record.uri?eid=2-s2.0-23944453935&doi=10.1109%2fTMI.2005.850542&partnerID=40&md5=a2d0feda8bf3d4fadc781245c73a9575","European Commission

Ministry of National Education and Religious Affairs","Final"
"Yang M., Xu D., Chen S., Li H., Shi Z.","Evaluation of machine learning approaches to predict soil organic matter and pH using vis-NIR spectra",2019,17,"https://www.scopus.com/inward/record.uri?eid=2-s2.0-85060046768&doi=10.3390%2fs19020263&partnerID=40&md5=a177c202a01e2b479e50d6d08d44c333","National Natural Science Foundation of China","Final"
"Gutierrez-Estevez D.M., Gramaglia M., Domenico A.D., Dandachi G., Khatibi S., Tsolkas D., Balan I., Garcia-Saavedra A., Elzur U., Wang Y.","Artificial intelligence for elastic management and orchestration of 5G networks",2019,17,"https://www.scopus.com/inward/record.uri?eid=2-s2.0-85071685939&doi=10.1109%2fMWC.2019.1800498&partnerID=40&md5=6cfd5b977dcb5c2728af237b64f305d9","Horizon 2020 Framework Programme

European Commission","Final"
"Santos J., Ferreira A., Flintsch G., Cerezo V.","A multi-objective optimisation approach for sustainable pavement management",2018,17,"https://www.scopus.com/inward/record.uri?eid=2-s2.0-85042217891&doi=10.1080%2f15732479.2018.1436571&partnerID=40&md5=4a5542b42902e951941ddd35fdf214fd","Fundação para a Ciência e a Tecnologia

European Regional Development Fund","Final"
"Koppel A., Paternain S., Richard C., Ribeiro A.","Decentralized Online Learning with Kernels",2018,17,"https://www.scopus.com/inward/record.uri?eid=2-s2.0-85046374155&doi=10.1109%2fTSP.2018.2830299&partnerID=40&md5=97aab232cb51fb81cc112ad6f544d1ea","National Science Foundation

Association of Research Libraries","Final"
"Duchateau N., Sermesant M., Delingette H., Ayache N.","Model-Based Generation of Large Databases of Cardiac Images: Synthesis of Pathological Cine MR Sequences from Real Healthy Cases",2018,17,"https://www.scopus.com/inward/record.uri?eid=2-s2.0-85021734920&doi=10.1109%2fTMI.2017.2714343&partnerID=40&md5=97d4529b98187fe73e81072e6995f942","Microsoft Research

Seventh Framework Programme

European Research Council

Seventh Framework Programme","Final"
"Law M.T., Thome N., Cord M.","Learning a Distance Metric from Relative Comparisons between Quadruplets of Images",2017,17,"https://www.scopus.com/inward/record.uri?eid=2-s2.0-84975254964&doi=10.1007%2fs11263-016-0923-4&partnerID=40&md5=cc3e9bf96efbff09491f95835ba526ba","Seventh Framework Programme","Final"
"Bellalij M., Reichel L., Rodriguez G., Sadok H.","Bounding matrix functionals via partial global block Lanczos decomposition",2015,17,"https://www.scopus.com/inward/record.uri?eid=2-s2.0-84926480731&doi=10.1016%2fj.apnum.2015.02.004&partnerID=40&md5=0ddf2e42e4a1fd4ed09add4588aa562e","National Science Foundation

EDF Energy","Final"
"Daaboul J., Castagna P., Da Cunha C., Bernard A.","Value network modelling and simulation for strategic analysis: A discrete event simulation approach",2014,17,"https://www.scopus.com/inward/record.uri?eid=2-s2.0-84905861954&doi=10.1080%2f00207543.2014.886787&partnerID=40&md5=d9530fa154fbe3d51caff48ff1a2311f","European Commission","Final"
"Grigoryeva L., Henriques J., Larger L., Ortega J.-P.","Stochastic nonlinear time series forecasting using time-delay reservoir computers: Performance and universality",2014,17,"https://www.scopus.com/inward/record.uri?eid=2-s2.0-84908648507&doi=10.1016%2fj.neunet.2014.03.004&partnerID=40&md5=983ba0885090c0b5938d1e0a04e3bde4","Schlumberger Foundation

Seventh Framework Programme","Final"
"Karray M.-H., Chebel-Morello B., Zerhouni N.","PETRA: Process Evolution using a TRAce-based system on a maintenance platform",2014,17,"https://www.scopus.com/inward/record.uri?eid=2-s2.0-84906950705&doi=10.1016%2fj.knosys.2014.03.010&partnerID=40&md5=08e4eceaacfc2d78c3bbd3097dec0e1b","European Regional Development Fund","Final"
"Papageorgiou E.I., Huszka C., De Roo J., Douali N., Jaulent M.-C., Colaert D.","Application of probabilistic and fuzzy cognitive approaches in semantic web framework for medical decision support",2013,17,"https://www.scopus.com/inward/record.uri?eid=2-s2.0-84885431976&doi=10.1016%2fj.cmpb.2013.07.008&partnerID=40&md5=8da4504531fb5ea4e9a8ab37cfa60bef","Seventh Framework Programme","Final"
"Wu X., Tournier M., Reveret L.","Natural character posing from a large motion database",2011,17,"https://www.scopus.com/inward/record.uri?eid=2-s2.0-79955534985&doi=10.1109%2fMCG.2009.111&partnerID=40&md5=7b38139643ff9c832b1e416e7a9000c7","National Science Foundation","Final"
"Santos J., Bressi S., Cerezo V., Lo Presti D.","SUP&R DSS: A sustainability-based decision support system for road pavements",2019,16,"https://www.scopus.com/inward/record.uri?eid=2-s2.0-85054805154&doi=10.1016%2fj.jclepro.2018.08.308&partnerID=40&md5=f5ef93161123190f1524753cc84a441f","Seventh Framework Programme","Final"
"Karanasiou G.S., Tripoliti E.E., Papadopoulos T.G., Kalatzis F.G., Goletsis Y., Naka K.K., Bechlioulis A., Errachid A., Fotiadis D.I.","Predicting adherence of patients with HF through machine learning techniques",2016,16,"https://www.scopus.com/inward/record.uri?eid=2-s2.0-85018428693&doi=10.1049%2fhtl.2016.0041&partnerID=40&md5=42cb6bee763761a2cfb7ef9cc2414428","Horizon 2020 Framework Programme","Final"
"Gancet J., Weiss P., Antonelli G., Pfingsthorn M.F., Calinon S., Turetta A., Walen C., Urbina D., Govindaraj S., Letier P., Martinez X., Salini J., Chemisky B., Indiveri G., Casalino G., Di Lillo P., Simetti E., De Palma D., Birk A., Fromm T., Mueller C., Tanwani A., Havoutis I., Caffaz A., Guilpain L.","Dexterous Undersea Interventions with Far Distance Onshore Supervision: the DexROV Project",2016,16,"https://www.scopus.com/inward/record.uri?eid=2-s2.0-84994093885&doi=10.1016%2fj.ifacol.2016.10.439&partnerID=40&md5=a66635ef2324be1eef57a834f458177b","Horizon 2020 Framework Programme","Final"
"Aziz H., Brill M., Fischer F., Harrenstein P., Lang J., Seedig H.G.","Possible and necessary winners of partial tournaments",2015,16,"https://www.scopus.com/inward/record.uri?eid=2-s2.0-84958552677&doi=10.1613%2fjair.4856&partnerID=40&md5=b02130f1e4d22fda044e385e8f4b55dd","Horizon 2020 Framework Programme

Seventh Framework Programme","Final"
"Prakosa A., Sermesant M., Allain P., Villain N., Rinaldi C.A., Rhode K., Razavi R., Delingette H., Ayache N.","Cardiac electrophysiological activation pattern estimation from images using a patient-specific database of synthetic image sequences",2014,16,"https://www.scopus.com/inward/record.uri?eid=2-s2.0-84893232494&doi=10.1109%2fTBME.2013.2281619&partnerID=40&md5=4c83edaf7ed965e97f9dbffe5d4c81df","Seventh Framework Programme","Final"
"Pascuet M.I., Castin N., Becquart C.S., Malerba L.","Stability and mobility of Cu-vacancy clusters in Fe-Cu alloys: A computational study based on the use of artificial neural networks for energy barrier calculations",2011,16,"https://www.scopus.com/inward/record.uri?eid=2-s2.0-79955467189&doi=10.1016%2fj.jnucmat.2011.02.038&partnerID=40&md5=90340bb128df92ad2aa19d44f03acad6","Seventh Framework Programme","Final"
"Li X.-D., Smarandache F., Dezert J., Dai X.-Z.","Combination of qualitative information with 2-tuple linguistic representation in DSmT",2009,16,"https://www.scopus.com/inward/record.uri?eid=2-s2.0-70349330802&doi=10.1007%2fs11390-009-9258-8&partnerID=40&md5=e8ae5509f2375d103cc6759b2f41f05f","National Natural Science Foundation of China","Final"
"Sam V., Tai C.-H., Garnier J., Gibrat J.-F., Lee B., Munson P.J.","Towards an automatic classification of protein structural domains based on structural similarity",2008,16,"https://www.scopus.com/inward/record.uri?eid=2-s2.0-40949146460&doi=10.1186%2f1471-2105-9-74&partnerID=40&md5=6287a4b869f18f2e08258987ee938a2d","National Cancer Institute

National Center for Research Resources","Final"
"Zhao C., Zhang H., Luan F., Zhang R., Liu M., Hu Z., Fan B.","QSAR method for prediction of protein-peptide binding affinity: Application to MHC class I molecule HLA-A*0201",2007,16,"https://www.scopus.com/inward/record.uri?eid=2-s2.0-34250845896&doi=10.1016%2fj.jmgm.2006.12.002&partnerID=40&md5=99ae623f31eeee5336c37cef0364e1c7","National Natural Science Foundation of China","Final"
"Hall D., Gal C.L., Martin J., Chomat O., Crowley J.L.","MagicBoard: A contribution to an intelligent office environment",2001,16,"https://www.scopus.com/inward/record.uri?eid=2-s2.0-0035973333&doi=10.1016%2fS0921-8890%2801%2900125-7&partnerID=40&md5=8fe2b21fc3edee522edfbb6a126d9bc5","European Commission

Centre National de la Recherche Scientifique","Final"
"Humeau J., Sauvat A., Cerrato G., Xie W., Loos F., Iannantuoni F., Bezu L., Lévesque S., Paillet J., Pol J., Leduc M., Zitvogel L., de Thé H., Kepp O., Kroemer G.","Inhibition of transcription by dactinomycin reveals a new characteristic of immunogenic cell stress",2020,15,"https://www.scopus.com/inward/record.uri?eid=2-s2.0-85083779026&doi=10.15252%2femmm.201911622&partnerID=40&md5=7b040847d66ec9a752359c0ab6f17b73","National Cancer Institute

Bristol-Myers Squibb

Association pour la Recherche sur le Cancer

Seerave Foundation

Agence Nationale de la Recherche

Fondation Leducq

Fondation pour la Recherche Médicale

Ligue Contre le Cancer

China Scholarship Council

Institut Universitaire de France

Institut National Du Cancer

Cancéropôle Ile de France

Chancellerie des Universités de Paris

High-end Foreign Experts Recruitment Plan of China

Labex Immuno-Oncology","Final"
"Li H.-Y., Zhao H.-T., Wei M.-L., Ruan H.-X., Shuang Y., Cui T.J., del Hougne P., Li L.","Intelligent Electromagnetic Sensing with Learnable Data Acquisition and Processing",2020,15,"https://www.scopus.com/inward/record.uri?eid=2-s2.0-85089142867&doi=10.1016%2fj.patter.2020.100006&partnerID=40&md5=2c9f28fd108c7a443de777005c58d16c","National Key Research and Development Program of China

National Natural Science Foundation of China","Final"
"Zawbaa H.M., Schiano S., Perez-Gandarillas L., Grosan C., Michrafy A., Wu C.-Y.","Computational intelligence modelling of pharmaceutical tabletting processes using bio-inspired optimization algorithms",2018,15,"https://www.scopus.com/inward/record.uri?eid=2-s2.0-85056986849&doi=10.1016%2fj.apt.2018.11.008&partnerID=40&md5=57a2cf8d8249002f4c72652a1c984500","Seventh Framework Programme

Marie Curie

Research Executive Agency

Seventh Framework Programme","Final"
"Bosc G., Boulicaut J.-F., Raïssi C., Kaytoue M.","Anytime discovery of a diverse set of patterns with Monte Carlo tree search",2018,15,"https://www.scopus.com/inward/record.uri?eid=2-s2.0-85037739730&doi=10.1007%2fs10618-017-0547-5&partnerID=40&md5=d3a92377b34e2d95bd009590275abdc2","Seventh Framework Programme

European Commission","Final"
"Mohamad S., Bouchachia A., Sayed-Mouchaweh M.","A Bi-Criteria Active Learning Algorithm for Dynamic Data Streams",2018,15,"https://www.scopus.com/inward/record.uri?eid=2-s2.0-84992437067&doi=10.1109%2fTNNLS.2016.2614393&partnerID=40&md5=864b251a0d5ee1f3fbb1e1ff60a84702","Horizon 2020 Framework Programme","Final"
"Jiang X., Gripon V., Berrou C., Rabbat M.","Storing Sequences in Binary Tournament-Based Neural Networks",2016,15,"https://www.scopus.com/inward/record.uri?eid=2-s2.0-84941928209&doi=10.1109%2fTNNLS.2015.2431319&partnerID=40&md5=4533176a0e85cf56511a7d3d4ebb25ea","Seventh Framework Programme

European Research Council

Seventh Framework Programme","Final"
"Shervashidze N., Bach F.","Learning the Structure for Structured Sparsity",2015,15,"https://www.scopus.com/inward/record.uri?eid=2-s2.0-84939824934&doi=10.1109%2fTSP.2015.2446432&partnerID=40&md5=cca10c8dcca4e911952bd58f348afc84","Seventh Framework Programme","Final"
"König A., Crispim-Junior C.F., Covella A.G.U., Bremond F., Derreumaux A., Bensadoun G., David R., Verhey F., Aalten P., Robert P.","Ecological assessment of autonomy in instrumental activities of daily living in dementia patients by the means of an automatic video monitoring system",2015,15,"https://www.scopus.com/inward/record.uri?eid=2-s2.0-84936089693&doi=10.3389%2ffnagi.2015.00098&partnerID=40&md5=c1d82e0b350b5d691768c143aef98f2d","Seventh Framework Programme","Final"
"Kane I.O., Vanderlinden J.-P., Baztan J., Touili N., Claus S.","Communicating risk through a DSS: A coastal risk centred empirical analysis",2014,15,"https://www.scopus.com/inward/record.uri?eid=2-s2.0-84896545042&doi=10.1016%2fj.coastaleng.2014.01.007&partnerID=40&md5=e7bec0484beb0b28d6e7001d1d9f8a72","Seventh Framework Programme

European Commission","Final"
"Grouin C., Grabar N., Hamon T., Rosset S., Tannier X., Zweigenbaum P.","Eventual situations for timeline extraction from clinical reports",2013,15,"https://www.scopus.com/inward/record.uri?eid=2-s2.0-84882766470&doi=10.1136%2famiajnl-2013-001627&partnerID=40&md5=7310f18294818a0e932f0e45870924c0","U.S. National Library of Medicine","Final"
"Su Y., Shan S., Chen X., Gao W.","Classifiability-based discriminatory projection pursuit",2011,15,"https://www.scopus.com/inward/record.uri?eid=2-s2.0-83855162246&doi=10.1109%2fTNN.2011.2170220&partnerID=40&md5=7c59360b39edec46b971efadecb593f3","National Natural Science Foundation of China

Natural Science Foundation of Beijing Municipality

National Basic Research Program of China (973 Program)","Final"
"Pang H., Hauser M., Minvielle S.","Pathway-based identification of SNPs predictive of survival",2011,15,"https://www.scopus.com/inward/record.uri?eid=2-s2.0-79956304186&doi=10.1038%2fejhg.2011.3&partnerID=40&md5=05ab075364a9dd0526f9a29dbd31958b","National Institutes of Health

National Cancer Institute","Final"
"Blanchet J., Forbes F.","Triplet Markov fields for the classification of complex structure data",2008,15,"https://www.scopus.com/inward/record.uri?eid=2-s2.0-43249090568&doi=10.1109%2fTPAMI.2008.27&partnerID=40&md5=9e7004cc7e308a42b791740d3edeb749","National Science Foundation","Final"
"Liu S., Kang K., Tarel J.-P., Cooper D.B.","Free-form object reconstruction from silhouettes, occluding edges and texture edges: A unified and robust operator based on duality",2008,15,"https://www.scopus.com/inward/record.uri?eid=2-s2.0-36448945085&doi=10.1109%2fTPAMI.2007.1143&partnerID=40&md5=e75e69fd4c51e14d95c55bb5f005d713","National Science Foundation","Final"
"Panigrahi S., Gioux S.","Machine learning approach for rapid and accurate estimation of optical properties using spatial frequency domain imaging",2019,14,"https://www.scopus.com/inward/record.uri?eid=2-s2.0-85058612139&doi=10.1117%2f1.JBO.24.7.071606&partnerID=40&md5=f2a285b6adc42fee861f79b5e1f1311c","Horizon 2020 Framework Programme

European Research Council

Université de Strasbourg","Final"
"Kuzovkin I., Vicente R., Petton M., Lachaux J.-P., Baciu M., Kahane P., Rheims S., Vidal J.R., Aru J.","Activations of deep convolutional neural networks are aligned with gamma band activity of human visual cortex",2018,14,"https://www.scopus.com/inward/record.uri?eid=2-s2.0-85071160307&doi=10.1038%2fs42003-018-0110-y&partnerID=40&md5=20c37d26b4e51d33e09f006a988a45ad","Horizon 2020 Framework Programme

Eesti Teadusagentuur

European Regional Development Fund","Final"
"Cavazza M., Lugrin J.-L., Hartley S., Le Renard M., Nandi A., Jacobson J., Crooks S.","Intelligent virtual environments for virtual reality art",2005,14,"https://www.scopus.com/inward/record.uri?eid=2-s2.0-27844467653&doi=10.1016%2fj.cag.2005.09.002&partnerID=40&md5=0e1ba8c9c53e3c75c8ba85c72b189941","European Commission","Final"
"Auriol E., Crowder R.M., McKendrick R., Rowe R., Knudsen T.","Integrating case-based reasoning and hypermedia documentation: An application for the diagnosis of a welding robot at Odense steel shipyard",1999,14,"https://www.scopus.com/inward/record.uri?eid=2-s2.0-0033284609&doi=10.1016%2fS0952-1976%2899%2900040-8&partnerID=40&md5=098f8bcc9453f14b2f9440de339caae0","Engineering and Physical Sciences Research Council

European Commission","Final"
"Berrouiguet S., Barrigón M.L., Castroman J.L., Courtet P., Artés-Rodríguez A., Baca-García E.","Combining mobile-health (mHealth) and artificial intelligence (AI) methods to avoid suicide attempts: The Smartcrises study protocol",2019,13,"https://www.scopus.com/inward/record.uri?eid=2-s2.0-85071896916&doi=10.1186%2fs12888-019-2260-y&partnerID=40&md5=cb2a4adf6e4dabf3fcf09ff4e7cbb6c3","American Foundation for Suicide Prevention

Comunidad de Madrid

Family Process Institute

European Commission

Ministerio de Economía y Competitividad

Fondation de France

Instituto de Salud Carlos III

European Regional Development Fund

Instituto de Investigación Sanitaria Fundación Jiménez Díaz

Agence de l’Innovation de Defense","Final"
"Marie F., Corbat L., Chaussy Y., Delavelle T., Henriet J., Lapayre J.-C.","Segmentation of deformed kidneys and nephroblastoma using Case-Based Reasoning and Convolutional Neural Network",2019,13,"https://www.scopus.com/inward/record.uri?eid=2-s2.0-85062915757&doi=10.1016%2fj.eswa.2019.03.010&partnerID=40&md5=9e340be56439b06c3324d4d8aafe16ef","Interreg

European Regional Development Fund

European Commission","Final"
"Luciano A.C.D.S., Picoli M.C.A., Rocha J.V., Franco H.C.J., Sanches G.M., Leal M.R.L.V., le Maire G.","Generalized space-time classifiers for monitoring sugarcane areas in Brazil",2018,13,"https://www.scopus.com/inward/record.uri?eid=2-s2.0-85049343861&doi=10.1016%2fj.rse.2018.06.017&partnerID=40&md5=17e15b1da8bb4ab02b52fb5ae3e46bde","Microsoft Research

Seventh Framework Programme

Fundação de Amparo à Pesquisa do Estado de São Paulo

Coordenação de Aperfeiçoamento de Pessoal de Nível Superior

Centre National d’Etudes Spatiales

Conselho Nacional de Desenvolvimento Científico e Tecnológico

Fundação de Amparo à Pesquisa e ao Desenvolvimento Científico e Tecnológico do Maranhão","Final"
"Bushdid C., De March C.A., Fiorucci S., Matsunami H., Golebiowski J.","Agonists of G-Protein-Coupled Odorant Receptors Are Predicted from Chemical Features",2018,13,"https://www.scopus.com/inward/record.uri?eid=2-s2.0-85046546598&doi=10.1021%2facs.jpclett.8b00633&partnerID=40&md5=ad321d30f26ce1010e379c7b8938eb33","National Science Foundation

National Institutes of Health

NIH Office of the Director

National Institute on Deafness and Other Communication Disorders

Gen Foundation

Agence Nationale de la Recherche

Fondation de France

National Science Foundation","Final"
"Cupertino L.F., Da Costa G., Pierson J.-M.","Towards a generic power estimator",2015,13,"https://www.scopus.com/inward/record.uri?eid=2-s2.0-84940239225&doi=10.1007%2fs00450-014-0264-x&partnerID=40&md5=471ab87cecf2ca7c3c47ec1f9c92b0a7","Seventh Framework Programme","Final"
"Liu X., Tredan G., Datta A.","A generic trust framework for large-scale open systems using machine learning",2014,13,"https://www.scopus.com/inward/record.uri?eid=2-s2.0-84911004967&doi=10.1111%2fcoin.12022&partnerID=40&md5=8e8e95b5499908e417c624d0b0386157","Horizon 2020 Framework Programme","Final"
"Cincotti S., Sornette D., Treleaven P., Battiston S., Caldarelli G., Hommes C., Kirman A.","An economic and financial exploratory",2012,13,"https://www.scopus.com/inward/record.uri?eid=2-s2.0-84870914311&doi=10.1140%2fepjst%2fe2012-01699-6&partnerID=40&md5=49da04777b253d9b0374eb0788a1818d","Seventh Framework Programme","Final"
"Chevalier Y., Rusinowitch M.","Decidability of e'uivalence of symbolic derivations",2012,13,"https://www.scopus.com/inward/record.uri?eid=2-s2.0-84863611369&doi=10.1007%2fs10817-010-9199-5&partnerID=40&md5=0cbf87b6f6a212f2ef428c1e716f5c24","Seventh Framework Programme","Final"
"Nouira H., Foltête E., Ait Brik B., Hirsinger L., Ballandras S.","Experimental characterization and modeling of microsliding on a small cantilever quartz beam",2008,13,"https://www.scopus.com/inward/record.uri?eid=2-s2.0-45849109551&doi=10.1016%2fj.jsv.2008.03.017&partnerID=40&md5=224f08c8718a35da14d2db5bf06bd4cc","European Commission

Centre National de la Recherche Scientifique","Final"
"Zilberstein S., Charpillet F., Chassaing P.","Optimal sequencing of contract algorithms",2003,13,"https://www.scopus.com/inward/record.uri?eid=2-s2.0-0038421244&doi=10.1023%2fA%3a1024412831598&partnerID=40&md5=96dd09f9931f1cf96b5471f088cce017","National Science Foundation

Institut national de recherche en informatique et en automatique (INRIA)","Final"
"Trave-Massuyés L., Milne R.","Diagnosis of dynamic systems based on explicit and implicit behavioral models: an application to gas turbines in esprit project tiger",1996,13,"https://www.scopus.com/inward/record.uri?eid=2-s2.0-0030141840&doi=10.1080%2f088395196118588&partnerID=40&md5=9fd984471c41f646250f0f12ac5f1f6f","European Commission","Final"
"Wu Z., Fan D., Zhou Y., Li R., Noack B.R.","Jet mixing optimization using machine learning control",2018,12,"https://www.scopus.com/inward/record.uri?eid=2-s2.0-85050914604&doi=10.1007%2fs00348-018-2582-4&partnerID=40&md5=b7c38ea33431a3710eb78b9311283279","Agence Nationale de la Recherche

National Natural Science Foundation of China","Final"
"Shtiliyanova A., Bellocchi G., Borras D., Eza U., Martin R., Carrère P.","Kriging-based approach to predict missing air temperature data",2017,12,"https://www.scopus.com/inward/record.uri?eid=2-s2.0-85030854670&doi=10.1016%2fj.compag.2017.09.033&partnerID=40&md5=6e3b3d5a230dddbe3d3e19b65f4f9a4b","Biotechnology and Biological Sciences Research Council

European Regional Development Fund","Final"
"Kuzmanovski V., Trajanov A., Leprince F., Džeroski S., Debeljak M.","Modeling water outflow from tile-drained agricultural fields",2015,12,"https://www.scopus.com/inward/record.uri?eid=2-s2.0-84908225918&doi=10.1016%2fj.scitotenv.2014.10.009&partnerID=40&md5=c064148bca0c63d8500b064d77b1a1b1","European Commission

European Social Fund","Final"
"Marnerides A.K., Malinowski S., Morla R., Kim H.S.","Fault diagnosis in DSL networks using support vector machines",2015,12,"https://www.scopus.com/inward/record.uri?eid=2-s2.0-84928826771&doi=10.1016%2fj.comcom.2015.01.006&partnerID=40&md5=ccb1b5fc96daefcd78a6b2ed0d86beef","National Science Foundation","Final"
"Van Der Steen M.C., Van Vugt F.T., Keller P.E., Altenmüller E.","Basic timing abilities stay intact in patients with musician's dystonia",2014,12,"https://www.scopus.com/inward/record.uri?eid=2-s2.0-84899832546&doi=10.1371%2fjournal.pone.0092906&partnerID=40&md5=54adfb27cc849363309064404c431028","Seventh Framework Programme","Final"
"Cox A., Chang B.-Y.E., Rival X.","Automatic analysis of open objects in dynamic language programs",2014,12,"https://www.scopus.com/inward/record.uri?eid=2-s2.0-84917713620&doi=10.1007%2f978-3-319-10936-7_9&partnerID=40&md5=78c5846b6b8d14e1f95645484d844be7","Seventh Framework Programme","Final"
"Castro M., Góes L.F.W., Méhaut J.-F.","Adaptive thread mapping strategies for transactional memory applications",2014,12,"https://www.scopus.com/inward/record.uri?eid=2-s2.0-84903137827&doi=10.1016%2fj.jpdc.2014.05.008&partnerID=40&md5=5972c8119ac3710e0ccdccea9440c4d6","Seventh Framework Programme","Final"
"Choury A., Bruinsma S., Schaeffer P.","Neural networks to predict exosphere temperature corrections",2013,12,"https://www.scopus.com/inward/record.uri?eid=2-s2.0-84892502467&doi=10.1002%2f2013SW000969&partnerID=40&md5=78e716d077584baf4eb39c108adccf48","Seventh Framework Programme","Final"
"Li Q., Deng Z., Zhang Y., Zhou X., Valentin Nagerl U., Wong S.T.C.","A global spatial similarity optimization scheme to track large numbers of dendritic spines in time-lapse confocal microscopy",2011,12,"https://www.scopus.com/inward/record.uri?eid=2-s2.0-79952182107&doi=10.1109%2fTMI.2010.2090354&partnerID=40&md5=9d25d4ee548b029722e5d6acfc062b88","National Science Foundation

National Institutes of Health

U.S. National Library of Medicine","Final"
"Goodman D.F.M., Brette R.","Spike-timing-based computation in sound localization",2010,12,"https://www.scopus.com/inward/record.uri?eid=2-s2.0-78649692447&doi=10.1371%2fjournal.pcbi.1000993&partnerID=40&md5=151d093963f1d4237c6166886a1b4bc3","Seventh Framework Programme","Final"
