Authors,Title,Year,Cited by,Link,Funding Details,Publication Stage
"Liu W., Safdari Shadloo M., Tlili I., Maleki A., Bach Q.-V.","The effect of alcohol–gasoline fuel blends on the engines’ performances and emissions",2020,11,"https://www.scopus.com/inward/record.uri?eid=2-s2.0-85084739523&doi=10.1016%2fj.fuel.2020.117977&partnerID=40&md5=ef121f0efac3ac1e53f24dc08441e02c","National Natural Science Foundation of China

Priority Academic Program Development of Jiangsu Higher Education Institutions","Final"
"Hirtzlin T., Bocquet M., Penkovsky B., Klein J.-O., Nowak E., Vianello E., Portal J.-M., Querlioz D.","Digital Biologically Plausible Implementation of Binarized Neural Networks With Differential Hafnium Oxide Resistive Memory Arrays",2020,11,"https://www.scopus.com/inward/record.uri?eid=2-s2.0-85078318321&doi=10.3389%2ffnins.2019.01383&partnerID=40&md5=1b4cb0ae31ae324cf6600202ed0fc4c9","Horizon 2020 Framework Programme

European Research Council

Agence Nationale de la Recherche","Final"
"Rugard M., Coumoul X., Carvaillo J.-C., Barouki R., Audouze K.","Deciphering Adverse Outcome Pathway Network Linked to Bisphenol F Using Text Mining and Systems Toxicology Approaches",2020,11,"https://www.scopus.com/inward/record.uri?eid=2-s2.0-85077482239&doi=10.1093%2ftoxsci%2fkfz214&partnerID=40&md5=ad44b8d778512ac99b3a2ca3e9600293","Horizon 2020 Framework Programme

Institut National de la Santé et de la Recherche Médicale

Horizon 2020

Université de Recherche Paris Sciences et Lettres","Final"
"Laffitte P., Wang Y., Sodoyer D., Girin L.","Assessing the performances of different neural network architectures for the detection of screams and shouts in public transportation",2019,11,"https://www.scopus.com/inward/record.uri?eid=2-s2.0-85053836739&doi=10.1016%2fj.eswa.2018.08.052&partnerID=40&md5=32a7430debc57682932bf3c959b3aab9","Seventh Framework Programme

European Commission

Conseil Général de l'Essonne","Final"
"Shah N.B., Tabibian B., Muandet K., Guyon I., Von Luxburg U.","Design and analysis of the NIPS 2016 review process",2018,11,"https://www.scopus.com/inward/record.uri?eid=2-s2.0-85055848459&partnerID=40&md5=827844e2a99e3a7613ae02d6acae8245","National Science Foundation

Deutsche Forschungsgemeinschaft

Eberhard Karls Universität Tübingen

Thailand Research Fund

Faculty of Science, Mahidol University","Final"
"Lebastard V., Boyer F., Lanneau S.","Reactive underwater object inspection based on artificial electric sense",2016,11,"https://www.scopus.com/inward/record.uri?eid=2-s2.0-84984710551&doi=10.1088%2f1748-3190%2f11%2f4%2f045003&partnerID=40&md5=9148a76243b5e957666b475f659c50ed","Horizon 2020 Framework Programme","Final"
"Kumar V., Koehl L., Zeng X.","A fully yarn integrated tag for tracking the international textile supply chain",2016,11,"https://www.scopus.com/inward/record.uri?eid=2-s2.0-84977260219&doi=10.1016%2fj.jmsy.2016.06.007&partnerID=40&md5=15f01c32811cfa98f061de87f94adc23","European Commission","Final"
"d'Orgeval T., Boulanger J.-P., Capalbo M.J., Guevara E., Penalba O., Meira S.","Yield estimation and sowing date optimization based on seasonal climate information in the three CLARIS sites",2010,11,"https://www.scopus.com/inward/record.uri?eid=2-s2.0-77149136394&doi=10.1007%2fs10584-009-9746-4&partnerID=40&md5=ea4ac19f23f2aaeb3d510a2b65850364","Sixth Framework Programme","Final"
"Delgorge C., Rosenberger C., Poisson G., Vieyres P.","Towards a new tool for the evaluation of the quality of ultrasound compressed images",2006,11,"https://www.scopus.com/inward/record.uri?eid=2-s2.0-33750842624&doi=10.1109%2fTMI.2006.883088&partnerID=40&md5=f28291ad42bfee16e1df0f02ac621e87","European Commission","Final"
"Xu Y., Sauquet D., Degoulet P., Jaulent M.-C.","Component-based mediation services for the integration of medical applications",2003,11,"https://www.scopus.com/inward/record.uri?eid=2-s2.0-0037345565&doi=10.1016%2fS0933-3657%2803%2900007-1&partnerID=40&md5=1d09ac5e32ae60f6898f544f741a7cf8","European Commission","Final"
"Wang C.-X., Renzo M.D., Stańczak S., Wang S., Larsson E.G.","Artificial Intelligence Enabled Wireless Networking for 5G and Beyond: Recent Advances and Future Challenges",2020,10,"https://www.scopus.com/inward/record.uri?eid=2-s2.0-85081679791&doi=10.1109%2fMWC.001.1900292&partnerID=40&md5=7364cf201b0bc69e3789044a03d5358d","National Natural Science Foundation of China

Southeast University

Fundamental Research Funds for the Central Universities","Final"
"Giri C., Jain S., Zeng X., Bruniaux P.","A Detailed Review of Artificial Intelligence Applied in the Fashion and Apparel Industry",2019,10,"https://www.scopus.com/inward/record.uri?eid=2-s2.0-85070237602&doi=10.1109%2fACCESS.2019.2928979&partnerID=40&md5=b22baf42d7b6eb5b5b56306fb8f94680","European Commission","Final"
"Tijou A., Rosi G., Vayron R., Lomami H.A., Hernigou P., Flouzat-Lachaniette C.-H., Haïat G.","Monitoring cementless femoral stem insertion by impact analyses: An in vitro study",2018,10,"https://www.scopus.com/inward/record.uri?eid=2-s2.0-85051942094&doi=10.1016%2fj.jmbbm.2018.08.009&partnerID=40&md5=f57e48f3557806db7fc6c9c784417551","Horizon 2020 Framework Programme

College of Natural Resources and Sciences, Humboldt State University

European Research Council

Centre National de la Recherche Scientifique","Final"
"Annane A., Bellahsene Z., Azouaou F., Jonquet C.","Building an effective and efficient background knowledge resource to enhance ontology matching",2018,10,"https://www.scopus.com/inward/record.uri?eid=2-s2.0-85046705752&doi=10.1016%2fj.websem.2018.04.001&partnerID=40&md5=6120b9743735b79d677a97a0282dfc18","Horizon 2020 Framework Programme

H2020 Marie Skłodowska-Curie Actions

College of Natural Resources and Sciences, Humboldt State University

Agence Nationale de la Recherche

Centre National de la Recherche Scientifique

Université de Montpellier","Final"
"Ding J., Han D., Dezert J., Yang Y.","A new hierarchical ranking aggregation method",2018,10,"https://www.scopus.com/inward/record.uri?eid=2-s2.0-85045558308&doi=10.1016%2fj.ins.2018.04.041&partnerID=40&md5=9c30dec471cf1211072961f6a4a21dac","National Natural Science Foundation of China

China Postdoctoral Science Foundation

Fundamental Research Funds for the Central Universities

Key Science and Technology Program of Shaanxi Province","Final"
"Gonzalez R., Fiacchini M., Iagnemma K.","Slippage prediction for off-road mobile robots via machine learning regression and proprioceptive sensing",2018,10,"https://www.scopus.com/inward/record.uri?eid=2-s2.0-85045124676&doi=10.1016%2fj.robot.2018.03.013&partnerID=40&md5=0607eee315586a47b82e5f85c41b13e4","National Aeronautics and Space Administration

Army Research Office

Defense Advanced Research Projects Agency

John D. and Catherine T. MacArthur Foundation

Ford Motor Company

U.S. Army Materiel Command

Massachusetts Institute of Technology

University of Michigan

M.S.I. Foundation

National Science Foundation","Final"
"Bron E., Daudon C., Pety J., Levrier F., Gerin M., Gratier P., Orkisz J.H., Guzman V., Bardeau S., Goicoechea J.R., Liszt H., Öberg K., Peretto N., Sievers A., Tremblin P.","Clustering the Orion B giant molecular cloud based on its molecular emission",2018,10,"https://www.scopus.com/inward/record.uri?eid=2-s2.0-85042095524&doi=10.1051%2f0004-6361%2f201731833&partnerID=40&md5=93b946156ecaa1de77c3d43f1b21e2bd","National Science Foundation

California Earthquake Authority

Seventh Framework Programme

European Research Council

Centre National d’Etudes Spatiales

Ministerio de Economía y Competitividad

Max-Planck-Gesellschaft

Centre National de la Recherche Scientifique

Commissariat à l'Énergie Atomique et aux Énergies Alternatives","Final"
"Bouvier G., Duclert-Savatier N., Desdouits N., Meziane-Cherif D., Blondel A., Courvalin P., Nilges M., Malliavin T.E.","Functional motions modulating VanA ligand binding unraveled by self-organizing maps",2014,10,"https://www.scopus.com/inward/record.uri?eid=2-s2.0-84893415679&doi=10.1021%2fci400354b&partnerID=40&md5=f2bd0f1275c718b099526613d6e7d30f","Seventh Framework Programme","Final"
"Hannagan T., Ktori M., Chanceaux M., Grainger J.","Deciphering CAPTCHAS: What a turing test reveals about human cognition",2012,10,"https://www.scopus.com/inward/record.uri?eid=2-s2.0-84857702528&doi=10.1371%2fjournal.pone.0032121&partnerID=40&md5=52e26ac26a3e1cbc94372e95f13781ef","Seventh Framework Programme","Final"
"Jonquet C., Cerri S.A.","The strobe model: Dynamic service generation on the grid",2005,10,"https://www.scopus.com/inward/record.uri?eid=2-s2.0-31444436584&doi=10.1080%2f08839510500234826&partnerID=40&md5=9a4d0fbbf7497b18cd85123f5f94ad8a","European Commission","Final"
"Su Y., Zhang K., Wang J., Zhou D., Madani K.","Performance analysis of multiple aggregated acoustic features for environment sound classification",2020,9,"https://www.scopus.com/inward/record.uri?eid=2-s2.0-85072748075&doi=10.1016%2fj.apacoust.2019.107050&partnerID=40&md5=a7a3b99fde6405b31592b373bce65213","National Natural Science Foundation of China

China Scholarship Council

Natural Science Foundation of Shaanxi Province","Final"
"Muller S., Lancrenon J., Harpes C., Le Traon Y., Gombault S., Bonnin J.-M.","A training-resistant anomaly detection system",2018,9,"https://www.scopus.com/inward/record.uri?eid=2-s2.0-85043535080&doi=10.1016%2fj.cose.2018.02.015&partnerID=40&md5=400df909e4461ea99054accdc422a558","Université du Luxembourg

European Commission

Fonds National de la Recherche Luxembourg","Final"
"Aboudib A., Gripon V., Coppin G.","A Biologically Inspired Framework for Visual Information Processing and an Application on Modeling Bottom-Up Visual Attention",2016,9,"https://www.scopus.com/inward/record.uri?eid=2-s2.0-84986243965&doi=10.1007%2fs12559-016-9430-8&partnerID=40&md5=335829913789cf84b9453fec1efd5a46","European Research Council","Final"
"Penciuc D., Le Duigou J., Daaboul J., Vallet F., Eynard B.","Product life cycle management approach for integration of engineering design and life cycle engineering",2016,9,"https://www.scopus.com/inward/record.uri?eid=2-s2.0-84989835839&doi=10.1017%2fS0890060416000366&partnerID=40&md5=8d338d808d01f339522d7ba3cdb7fc0d","Seventh Framework Programme","Final"
"Maitre M., Guillemot C., Morin L.","3-D model-based frame interpolation for distributed video coding of static scenes",2007,9,"https://www.scopus.com/inward/record.uri?eid=2-s2.0-34247329359&doi=10.1109%2fTIP.2007.894272&partnerID=40&md5=27cf8e4da5455a94c7f793884d449f03","European Commission","Final"
"Bailleux O., Marquis P.","Some computational aspects of distance-sat",2006,9,"https://www.scopus.com/inward/record.uri?eid=2-s2.0-33847285607&doi=10.1007%2fs10817-006-9063-9&partnerID=40&md5=2bebaaffa64f65801049626e03010f1f","European Regional Development Fund","Final"
"Dutta S.","Approximate reasoning by analogy to answer null queries",1991,9,"https://www.scopus.com/inward/record.uri?eid=2-s2.0-0006452516&doi=10.1016%2f0888-613X%2891%2990018-H&partnerID=40&md5=ab155307f3e3b0d35c3122597f28f615","National Science Foundation","Final"
"Galateau Salle F., Le Stang N., Tirode F., Courtiol P., Nicholson A.G., Tsao M.-S., Tazelaar H.D., Churg A., Dacic S., Roggli V., Pissaloux D., Maussion C., Moarii M., Beasley M.B., Begueret H., Chapel D.B., Copin M.C., Gibbs A.R., Klebe S., Lantuejoul S., Nabeshima K., Vignaud J.-M., Attanoos R., Brcic L., Capron F., Chirieac L.R., Damiola F., Sequeiros R., Cazes A., Damotte D., Foulet A., Giusiano-Courcambeck S., Hiroshima K., Hofman V., Husain A.N., Kerr K., Marchevsky A., Paindavoine S., Picquenot J.M., Rouquette I., Sagan C., Sauter J., Thivolet F., Brevet M., Rouvier P., Travis W.D., Planchard G., Weynand B., Clozel T., Wainrib G., Fernandez-Cuesta L., Pairon J.-C., Rusch V., Girard N.","Comprehensive Molecular and Pathologic Evaluation of Transitional Mesothelioma Assisted by Deep Learning Approach: A Multi-Institutional Study of the International Mesothelioma Panel from the MESOPATH Reference Center",2020,8,"https://www.scopus.com/inward/record.uri?eid=2-s2.0-85083770350&doi=10.1016%2fj.jtho.2020.01.025&partnerID=40&md5=5e47f62c008bd2cdd48518b706a32f22","National Institutes of Health

National Cancer Institute

Genentech

Roche

International Association for the Study of Lung Cancer

Meso Scale Diagnostics

Intuitive Surgical

Singapore Police Force

Institut National Du Cancer","Final"
"Yue J., Hu Z., He R., Zhang X., Dulout J., Li C., Guerrero J.M.","Cloud-fog architecture based energy management and decision-making for next-generation distribution network with prosumers and internet of things devices",2019,8,"https://www.scopus.com/inward/record.uri?eid=2-s2.0-85060368071&doi=10.3390%2fapp9030372&partnerID=40&md5=4a5dadfc032da3f36d9e159916a64f92","National Natural Science Foundation of China","Final"
"Kakas A.C., Moraitis P., Spanoudakis N.I.","GORGIAS: Applying argumentation",2019,8,"https://www.scopus.com/inward/record.uri?eid=2-s2.0-85058390935&doi=10.3233%2fAAC-181006&partnerID=40&md5=524619e5ce1900d8f125329225a71171","European Commission","Final"
"Siudek M., Małek K., Pollo A., Krakowski T., Iovino A., Scodeggio M., Moutard T., Zamorani G., Guzzo L., Garilli B., Granett B.R., Bolzonella M., De La Torre S., Abbas U., Adami C., Bottini D., Cappi A., Cucciati O., Davidzon I., Franzetti P., Fritz A., Krywult J., Le Brun V., Le Fèvre O., MacCagni D., Marulli F., Polletta M., Tasca L.A.M., Tojeiro R., Vergani D., Zanichelli A., Arnouts S., Bel J., Branchini E., Coupon J., De Lucia G., Ilbert O., Haines C.P., Moscardini L., Takeuchi T.T.","The VIMOS Public Extragalactic Redshift Survey (VIPERS): The complexity of galaxy populations at 0.4 < z < 1.3 revealed with unsupervised machine-learning algorithms",2018,8,"https://www.scopus.com/inward/record.uri?eid=2-s2.0-85054038119&doi=10.1051%2f0004-6361%2f201832784&partnerID=40&md5=e9d8a22e1f2f01607d9b0e72ebf752e3","Seventh Framework Programme

European Research Council

Narodowe Centrum Nauki","Final"
"Fang Y., Lei J., Li J., Xu L., Lin W., Callet P.L.","Learning visual saliency from human fixations for stereoscopic images",2017,8,"https://www.scopus.com/inward/record.uri?eid=2-s2.0-85019705975&doi=10.1016%2fj.neucom.2017.05.050&partnerID=40&md5=5d3c50807133bf7597319efc2bc7f811","National Natural Science Foundation of China

Natural Science Foundation of Jiangxi Province","Final"
"Naredo E., Trujillo L., Legrand P., Silva S., Muñoz L.","Evolving genetic programming classifiers with novelty search",2016,8,"https://www.scopus.com/inward/record.uri?eid=2-s2.0-84978123631&doi=10.1016%2fj.ins.2016.06.044&partnerID=40&md5=34f04cdc79b3d1de5e171c080877157b","Seventh Framework Programme

Tecnológico Nacional de México

Consejo Nacional de Ciencia y Tecnología

Dirección General de Educación Superior Tecnológica","Final"
"Leger G., Barragan M.J.","Brownian distance correlation-directed search: A fast feature selection technique for alternate test",2016,8,"https://www.scopus.com/inward/record.uri?eid=2-s2.0-84969746077&doi=10.1016%2fj.vlsi.2016.05.003&partnerID=40&md5=9e1a3b1ba6b5a2194a12feaad9361ca7","Labex

European Regional Development Fund","Final"
"Fogel F., D'Aspremont A., Vojnovic M.","Spectral ranking using seriation",2016,8,"https://www.scopus.com/inward/record.uri?eid=2-s2.0-84979917180&partnerID=40&md5=f3307ff0366e640adc10d674d3ed3d4f","Institut national de recherche en informatique et en automatique (INRIA)

European Research Council

European Research Council

Centre National de la Recherche Scientifique","Final"
"Kozoderov V.V., Dmitriev E.V., Sokolov A.A.","Improved technique for retrieval of forest parameters from hyperspectral remote sensing data",2015,8,"https://www.scopus.com/inward/record.uri?eid=2-s2.0-84957605413&doi=10.1364%2fOE.23.0A1342&partnerID=40&md5=a86e07251b3c66e1b40f5faf4312553f","Agence Nationale de la Recherche

Russian Foundation for Basic Research

European Regional Development Fund","Final"
"Fonooni B., Jevtić A., Hellström T., Janlert L.-E.","Applying ant colony optimization algorithms for high-level behavior learning and reproduction from demonstrations",2015,8,"https://www.scopus.com/inward/record.uri?eid=2-s2.0-84921434684&doi=10.1016%2fj.robot.2014.12.001&partnerID=40&md5=193e42577624b2b3f43ec7120f454fc4","Seventh Framework Programme

European Commission","Final"
"Wiederkehr C., Basavaraj R., de Menthière C.S., Koch R., Schlecht U., Hermida L., Masdoua B., Ishii R., Cassen V., Yamamoto M., Lane C., Cherry M., Lamb N., Primig M.","Database model specification of GermOnline Release 2.0, a cross-species community annotation knowledgebase on germ cell differentiation",2004,8,"https://www.scopus.com/inward/record.uri?eid=2-s2.0-11144358098&doi=10.1093%2fbioinformatics%2fbth030&partnerID=40&md5=7b350941dfefa26d267c8da5ea8dbff9","National Science Foundation

Schweizerischer Nationalfonds zur Förderung der Wissenschaftlichen Forschung

Schweizerischer Nationalfonds zur Förderung der Wissenschaftlichen Forschung

Institut National de la Santé et de la Recherche Médicale

Centre National de la Recherche Scientifique","Final"
"Zahid M., Chen Y., Jamal A., Mamadou C.Z.","Freeway short-term travel speed prediction based on data collection time-horizons: A fast forest quantile regression approach",2020,7,"https://www.scopus.com/inward/record.uri?eid=2-s2.0-85079004685&doi=10.3390%2fsu12020646&partnerID=40&md5=41752bd0facdbdf6ade89b59687c32fc","National Natural Science Foundation of China

Beijing University of Technology","Final"
"Njage P.M.K., Henri C., Leekitcharoenphon P., Mistou M.-Y., Hendriksen R.S., Hald T.","Machine Learning Methods as a Tool for Predicting Risk of Illness Applying Next-Generation Sequencing Data",2019,7,"https://www.scopus.com/inward/record.uri?eid=2-s2.0-85056840261&doi=10.1111%2frisa.13239&partnerID=40&md5=bb9cfb1a026cfbd97d843219ed8dc351","Horizon 2020 Framework Programme","Final"
"Ahmad M.W., Mouraud A., Rezgui Y., Mourshed M.","Deep highway networks and tree-based ensemble for predicting short-term building energy consumption",2018,7,"https://www.scopus.com/inward/record.uri?eid=2-s2.0-85059323958&doi=10.3390%2fen11123408&partnerID=40&md5=4491c674ff8262d22055a3bb0600fb37","Myelin Project

Horizon 2020 Framework Programme","Final"
"van Ditmarsch H., French T., Velázquez-Quesada F.R., Wáng Y.N.","Implicit, explicit and speculative knowledge",2018,7,"https://www.scopus.com/inward/record.uri?eid=2-s2.0-85036469185&doi=10.1016%2fj.artint.2017.11.004&partnerID=40&md5=434fdaaf5546129c9ec8d6f3aa5cd9c0","European Research Council

National Office for Philosophy and Social Sciences","Final"
"Tijou A., Rosi G., Hernigou P., Flouzat-Lachaniette C.-H., Haïat G.","Ex vivo evaluation of cementless acetabular cup stability using impact analyses with a hammer instrumented with strain sensors",2018,7,"https://www.scopus.com/inward/record.uri?eid=2-s2.0-85039801166&doi=10.3390%2fs18010062&partnerID=40&md5=8768df3135108825a7741b19da1305ee","Horizon 2020 Framework Programme

European Research Council

Horizon 2020","Final"
"Reynolds A., Blanchette J.C.","A Decision Procedure for (Co)datatypes in SMT Solvers",2017,7,"https://www.scopus.com/inward/record.uri?eid=2-s2.0-84966552443&doi=10.1007%2fs10817-016-9372-6&partnerID=40&md5=dcdbee3e5141ee30b2a6395a6bf972e0","Horizon 2020 Framework Programme

Deutsche Forschungsgemeinschaft","Final"
"Altarelli F., Braunstein A., Dall'Asta L., De Bacco C., Franz S.","The edge-disjoint path problem on random graphs by message-passing",2015,7,"https://www.scopus.com/inward/record.uri?eid=2-s2.0-84957575197&doi=10.1371%2fjournal.pone.0145222&partnerID=40&md5=098e3e6768b4ebb1139360114436b40b","National Science Foundation

Seventh Framework Programme

European Research Council

Seventh Framework Programme","Final"
"Morvant E.","Domain adaptation of weighted majority votes via perturbed variation-based self-labeling",2015,7,"https://www.scopus.com/inward/record.uri?eid=2-s2.0-84908439509&doi=10.1016%2fj.patrec.2014.08.013&partnerID=40&md5=f9afa26b8c2ebd6568a15fc0ea1f0a46","Seventh Framework Programme","Final"
"Arias-Castro E., Pelletier B.","On the convergence of Maximum Variance Unfolding",2013,7,"https://www.scopus.com/inward/record.uri?eid=2-s2.0-84884232847&partnerID=40&md5=0d587a8e25e9176a274f2f58d762092d",,"Final"
"Imre E., Alatan A.A., Güdükbay U.","Rate-distortion efficient piecewise planar 3-D scene representation from 2-D images",2009,7,"https://www.scopus.com/inward/record.uri?eid=2-s2.0-61349181806&doi=10.1109%2fTIP.2008.2010071&partnerID=40&md5=1651bad2bd7d96abf394a7a906f2134c","European Commission","Final"
"Bidaut G., Manion F.J., Garcia C., Ochs M.F.","WaveRead: Automatic measurement of relative gene expression levels from microarrays using wavelet analysis",2006,7,"https://www.scopus.com/inward/record.uri?eid=2-s2.0-33745822453&doi=10.1016%2fj.jbi.2005.10.001&partnerID=40&md5=27882af750e7a611b434a36d928f6bfc","National Institutes of Health

National Cancer Institute","Final"
"Kouamé D., Biard M., Girault J.-M., Bleuzen A.","Adaptive AR and neurofuzzy approaches: Access to cerebral particle signatures",2006,7,"https://www.scopus.com/inward/record.uri?eid=2-s2.0-33746905456&doi=10.1109%2fTITB.2005.862463&partnerID=40&md5=8b61ca39d45401d81bdf5ee1090f5505","European Commission","Final"
"Bag S., Pretorius J.H.C., Gupta S., Dwivedi Y.K.","Role of institutional pressures and resources in the adoption of big data analytics powered artificial intelligence, sustainable manufacturing practices and circular economy capabilities",2021,6,"https://www.scopus.com/inward/record.uri?eid=2-s2.0-85094891544&doi=10.1016%2fj.techfore.2020.120420&partnerID=40&md5=6095123f04ff28e9a36f478add3ec890","National Natural Science Foundation of China","Final"
"Schürholz D., Kubler S., Zaslavsky A.","Artificial intelligence-enabled context-aware air quality prediction for smart cities",2020,6,"https://www.scopus.com/inward/record.uri?eid=2-s2.0-85088373071&doi=10.1016%2fj.jclepro.2020.121941&partnerID=40&md5=62d5d628ba2213d27239c58e6e4b4e42","European Commission","Final"
"Dagkakis G., Rotondo A., Heavey C.","Embedding optimization with deterministic discrete event simulation for assignment of cross-trained operators: An assembly line case study",2019,6,"https://www.scopus.com/inward/record.uri?eid=2-s2.0-85067614525&doi=10.1016%2fj.cor.2019.06.008&partnerID=40&md5=44b02737f4cce83465c8663f6ff1bd4e","Science Foundation Ireland

Seventh Framework Programme

European Regional Development Fund","Final"
"Caroux L., Consel C., Dupuy L., Sauzéon H.","Towards context-aware assistive applications for aging in place via real-life-proof activity detection",2018,6,"https://www.scopus.com/inward/record.uri?eid=2-s2.0-85056666027&doi=10.3233%2fAIS-180505&partnerID=40&md5=954910dc4aa77d27f86e37738a8f5944","European Commission

Conseil Régional Aquitaine","Final"
"Ludusan B., Cristia A., Martin A., Mazuka R., Dupoux E.","Learnability of prosodic boundaries: Is infant-directed speech easier?",2016,6,"https://www.scopus.com/inward/record.uri?eid=2-s2.0-84983399635&doi=10.1121%2f1.4960576&partnerID=40&md5=78b77f4984db2920c3e22a3289b05f19","European Research Council

Agence Nationale de la Recherche

Fondation de France","Final"
"Hu Q., Lu Y., Pan Z., Gong Y., Yang Z.","Can AI artifacts influence human cognition? The effects of artificial autonomy in intelligent personal assistants",2021,5,"https://www.scopus.com/inward/record.uri?eid=2-s2.0-85092706415&doi=10.1016%2fj.ijinfomgt.2020.102250&partnerID=40&md5=39655084a26f37579d7c89ba222d2881","National Natural Science Foundation of China

National Office for Philosophy and Social Sciences","Final"
"Chassagnon G., Vakalopoulou M., Battistella E., Christodoulidis S., Hoang-Thi T.-N., Dangeard S., Deutsch E., Andre F., Guillo E., Halm N., El Hajj S., Bompard F., Neveu S., Hani C., Saab I., Campredon A., Koulakian H., Bennani S., Freche G., Barat M., Lombard A., Fournier L., Monnier H., Grand T., Gregory J., Nguyen Y., Khalil A., Mahdjoub E., Brillet P.-Y., Tran Ba S., Bousson V., Mekki A., Carlier R.-Y., Revel M.-P., Paragios N.","AI-driven quantification, staging and outcome prediction of COVID-19 pneumonia",2021,5,"https://www.scopus.com/inward/record.uri?eid=2-s2.0-85095434755&doi=10.1016%2fj.media.2020.101860&partnerID=40&md5=b9bdab31b866793547ff66eec4e40d43","GE Healthcare

Horizon 2020 Framework Programme

Schweizerischer Nationalfonds zur Förderung der Wissenschaftlichen Forschung

Fondation pour la Recherche Médicale

Horizon 2020","Final"
"Ferreira A.C., Silva L.R., Renna F., Brandl H.B., Renoult J.P., Farine D.R., Covas R., Doutrelant C.","Deep learning-based methods for individual recognition in small birds",2020,5,"https://www.scopus.com/inward/record.uri?eid=2-s2.0-85088437533&doi=10.1111%2f2041-210X.13436&partnerID=40&md5=9a7ab59f8ee0fd855c26a0b618594f16","Horizon 2020 Framework Programme

European Research Council

Deutsche Forschungsgemeinschaft

Agence Nationale de la Recherche

Fundação para a Ciência e a Tecnologia

Max-Planck-Gesellschaft

University of Cape Town

Horizon 2020","Final"
"Dohmatob E., Dumas G., Bzdok D.","Dark control: The default mode network as a reinforcement learning agent",2020,5,"https://www.scopus.com/inward/record.uri?eid=2-s2.0-85085932156&doi=10.1002%2fhbm.25019&partnerID=40&md5=d1e3fe32fa24af728c9f91f5b2ab3067","Canadian Institute for Advanced Research

Amazon Web Services

Seventh Framework Programme

Deutsche Forschungsgemeinschaft

Studienstiftung des Deutschen Volkes

Seventh Framework Programme

RWTH Aachen University

Innovative Medicines Initiative

Canada First Research Excellence Fund

Faculty of Medicine, Prince of Songkla University","Final"
