Authors,Title,Year,Cited by,Link,Funding Details,Publication Stage
"Ferecatu M., Geman D.","A statistical framework for image category search from a mental picture",2009,31,"https://www.scopus.com/inward/record.uri?eid=2-s2.0-65549145185&doi=10.1109%2fTPAMI.2008.259&partnerID=40&md5=2b0c0a2b4bfa4c0ff0291a4e0bb9c988","National Science Foundation

Office of Naval Research","Final"
"VanRullen R.","Perception science in the age of deep neural networks",2017,30,"https://www.scopus.com/inward/record.uri?eid=2-s2.0-85014025253&doi=10.3389%2ffpsyg.2017.00142&partnerID=40&md5=4328e28699d26aa793afd3f1811f4e71","Seventh Framework Programme","Final"
"Zodiatis G., De Dominicis M., Perivoliotis L., Radhakrishnan H., Georgoudis E., Sotillo M., Lardner R.W., Krokos G., Bruciaferri D., Clementi E., Guarnieri A., Ribotti A., Drago A., Bourma E., Padorno E., Daniel P., Gonzalez G., Chazot C., Gouriou V., Kremer X., Sofianos S., Tintore J., Garreau P., Pinardi N., Coppini G., Lecci R., Pisano A., Sorgente R., Fazioli L., Soloviev D., Stylianou S., Nikolaidis A., Panayidou X., Karaolia A., Gauci A., Marcati A., Caiazzo L., Mancini M.","The Mediterranean Decision Support System for Marine Safety dedicated to oil slicks predictions",2016,30,"https://www.scopus.com/inward/record.uri?eid=2-s2.0-84994837786&doi=10.1016%2fj.dsr2.2016.07.014&partnerID=40&md5=1a5d4bb746e110e2557be834ca005577","Horizon 2020 Framework Programme

Seventh Framework Programme

Natural Environment Research Council

European Regional Development Fund","Final"
"Bach F.","Duality between subgradient and conditional gradient methods",2015,30,"https://www.scopus.com/inward/record.uri?eid=2-s2.0-84925446322&doi=10.1137%2f130941961&partnerID=40&md5=61fe1cdf5805e92ea8ded84deec458ee","Seventh Framework Programme","Final"
"Schillings C., Wanderer T., Cameron L., van der Wal J.T., Jacquemin J., Veum K.","A decision support system for assessing offshore wind energy potential in the North Sea",2012,30,"https://www.scopus.com/inward/record.uri?eid=2-s2.0-84865590669&doi=10.1016%2fj.enpol.2012.06.056&partnerID=40&md5=c3b4db6ef79c006ba8b18376b7aaea74","European Commission","Final"
"Lauber J., Guerra T.M., Dambrine M.","Air-fuel ratio control in a gasoline engine",2011,30,"https://www.scopus.com/inward/record.uri?eid=2-s2.0-78649471294&doi=10.1080%2f00207720902957236&partnerID=40&md5=1ad5e58d0fa0008d801d1612d6758a3b","European Regional Development Fund","Final"
"Hadria R., Duchemin B., Baup F., Le Toan T., Bouvet A., Dedieu G., Le Page M.","Combined use of optical and radar satellite data for the detection of tillage and irrigation operations: Case study in Central Morocco",2009,30,"https://www.scopus.com/inward/record.uri?eid=2-s2.0-64949130096&doi=10.1016%2fj.agwat.2009.02.010&partnerID=40&md5=acb6d32147e1ce5cf155bfedff5316c7","European Commission

Centre National de la Recherche Scientifique","Final"
"Saigo H., Vert J.-P., Akutsu T.","Optimizing amino acid substitution matrices with a local alignment kernel",2006,30,"https://www.scopus.com/inward/record.uri?eid=2-s2.0-33746329568&doi=10.1186%2f1471-2105-7-246&partnerID=40&md5=0937d895dc1f9c2638308377e210bb1e","National Human Genome Research Institute","Final"
"Cayirci E., Garaga A., Santana de Oliveira A., Roudier Y.","A risk assessment model for selecting cloud service providers",2016,29,"https://www.scopus.com/inward/record.uri?eid=2-s2.0-85006094577&doi=10.1186%2fs13677-016-0064-x&partnerID=40&md5=e88b6552c91f3f16342254aabc842e89","Seventh Framework Programme","Final"
"Del Pilar Salas-Zárate M., López-López E., Valencia-García R., Aussenac-Gilles N., Almela Á., Alor-Hernández G.","A study on LIWC categories for opinion mining in Spanish reviews",2014,29,"https://www.scopus.com/inward/record.uri?eid=2-s2.0-84916631148&doi=10.1177%2f0165551514547842&partnerID=40&md5=b3017df893176214d4b9b0145d208e8f","European Commission

Consejo Nacional de Ciencia y Tecnología

Ministerio de Economía y Competitividad

European Regional Development Fund","Final"
"Djurabekova F.G., Domingos R., Cerchiara G., Castin N., Vincent E., Malerba L.","Artificial intelligence applied to atomistic kinetic Monte Carlo simulations in Fe-Cu alloys",2007,29,"https://www.scopus.com/inward/record.uri?eid=2-s2.0-33846906178&doi=10.1016%2fj.nimb.2006.11.039&partnerID=40&md5=c2c8e290fb9c8f448e485ac08ecb2d1b","European Commission

Belgian Federal Science Policy Office","Final"
"Zheng Y., Shadloo M.S., Nasiri H., Maleki A., Karimipour A., Tlili I.","Prediction of viscosity of biodiesel blends using various artificial model and comparison with empirical correlations",2020,28,"https://www.scopus.com/inward/record.uri?eid=2-s2.0-85080142484&doi=10.1016%2fj.renene.2020.02.087&partnerID=40&md5=6175fab8ed4f0a205b7cd872e1c5dcdc","National Natural Science Foundation of China","Final"
"Huang Y., Gutterman C.L., Samadi P., Cho P.B., Samoud W., Ware C., Lourdiane M., Zussman G., Bergman K.","Dynamic mitigation of EDFA power excursions with machine learning",2017,28,"https://www.scopus.com/inward/record.uri?eid=2-s2.0-85011672498&doi=10.1364%2fOE.25.002245&partnerID=40&md5=2bcd7b6309ce4d0cb9d314ca14a7eeb7","National Science Foundation

U.S. Department of Energy

Advanced Scientific Computing Research","Final"
"Douali N., Csaba H., De Roo J., Papageorgiou E.I., Jaulent M.-C.","Diagnosis Support System based on clinical guidelines: Comparison between case-based fuzzy cognitive maps and bayesian networks",2014,28,"https://www.scopus.com/inward/record.uri?eid=2-s2.0-84887826026&doi=10.1016%2fj.cmpb.2013.09.012&partnerID=40&md5=212316e3b6a0115c573bba4cd210351d","Seventh Framework Programme","Final"
"Gossett E., Toher C., Oses C., Isayev O., Legrain F., Rose F., Zurek E., Carrete J., Mingo N., Tropsha A., Curtarolo S.","AFLOW-ML: A RESTful API for machine-learning predictions of materials properties",2018,27,"https://www.scopus.com/inward/record.uri?eid=2-s2.0-85047645950&doi=10.1016%2fj.commatsci.2018.03.075&partnerID=40&md5=13571b3ed36645d6ca2669b9f45ba05b","National Science Foundation

Alexander von Humboldt-Stiftung

Duke University

National Stroke Foundation

Max-Planck-Gesellschaft

National Science Foundation","Final"
"Banzhaf W., Baumgaertner B., Beslon G., Doursat R., Foster J.A., McMullin B., de Melo V.V., Miconi T., Spector L., Stepney S., White R.","Defining and simulating open-ended novelty: requirements, guidelines, and challenges",2016,27,"https://www.scopus.com/inward/record.uri?eid=2-s2.0-84971643949&doi=10.1007%2fs12064-016-0229-7&partnerID=40&md5=4d7ecfba27ae3e02e14946f4c75a2f68","Seventh Framework Programme","Final"
"Gatto L., Breckels L.M., Burger T., Nightingale D.J.H., Groen A.J., Campbell C., Nikolovski N., Mulvey C.M., Christoforou A., Ferro M., Lilley K.S.","A foundation for reliable spatial proteomics data analysis",2014,27,"https://www.scopus.com/inward/record.uri?eid=2-s2.0-84905215664&doi=10.1074%2fmcp.M113.036350&partnerID=40&md5=c484e82379798f71782c41b0e8c4b072","Seventh Framework Programme

Biotechnology and Biological Sciences Research Council","Final"
"Benedek C., Szirányi T., Kato Z., Zerubia J.","Detection of object motion regions in aerial image pairs with a multilayer markovian model",2009,27,"https://www.scopus.com/inward/record.uri?eid=2-s2.0-70349442338&doi=10.1109%2fTIP.2009.2025808&partnerID=40&md5=d5c00fff4cde9f175d5ea63c449e82bc","Institut national de recherche en informatique et en automatique (INRIA)

European Commission","Final"
"Van Hentenryck P., Michel L., Benhamou F.","Newton: Constraint programming over nonlinear constraints",1998,27,"https://www.scopus.com/inward/record.uri?eid=2-s2.0-0031619233&doi=10.1016%2fs0167-6423%2897%2900008-7&partnerID=40&md5=249a858963d1bb223cef0e892e546b05","National Science Foundation

Office of Naval Research","Final"
"Allaoui H., Guo Y., Sarkis J.","Decision support for collaboration planning in sustainable supply chains",2019,26,"https://www.scopus.com/inward/record.uri?eid=2-s2.0-85065847564&doi=10.1016%2fj.jclepro.2019.04.367&partnerID=40&md5=79a4d21178a9f70fb9e1b736f1ba1425","Interreg","Final"
"Santos J., Ferreira A., Flintsch G.","A multi-objective optimization-based pavement management decision-support system for enhancing pavement sustainability",2017,26,"https://www.scopus.com/inward/record.uri?eid=2-s2.0-85027504439&doi=10.1016%2fj.jclepro.2017.07.027&partnerID=40&md5=3f4963aea292fe69ba1414a0d0a28d64","Virginia Department of Transportation

Fundação para a Ciência e a Tecnologia

European Regional Development Fund","Final"
"Han J., Zhang Z., Cummins N., Ringeval F., Schuller B.","Strength modelling for real-worldautomatic continuous affect recognition from audiovisual signals",2017,26,"https://www.scopus.com/inward/record.uri?eid=2-s2.0-85008150025&doi=10.1016%2fj.imavis.2016.11.020&partnerID=40&md5=ad1c8982168d55be77f52fc994a53ceb","Horizon 2020 Framework Programme

Seventh Framework Programme

Urban Innovative Actions

European Research Council

Seventh Framework Programme","Final"
"Kasparick M., Cavalcante R.L.G., Valentin S., Stańczak S., Yukawa M.","Kernel-Based Adaptive Online Reconstruction of Coverage Maps With Side Information",2016,26,"https://www.scopus.com/inward/record.uri?eid=2-s2.0-84979294060&doi=10.1109%2fTVT.2015.2453391&partnerID=40&md5=35f2b4d578d6dcea4c528c05e6a6af45","Alcatel-Lucent

Seventh Framework Programme

European Commission

KDDI Foundation","Final"
"Stefanakis T.S., Contal E., Vayatis N., Dias F., Synolakis C.E.","Can small islands protect nearby coasts from tsunamis? An active experimental design approach",2014,26,"https://www.scopus.com/inward/record.uri?eid=2-s2.0-84944141699&doi=10.1098%2frspa.2014.0575&partnerID=40&md5=4a7283e4b8ca325a7536eb1d6df53546","Seventh Framework Programme

Santa Fe Institute

University College Dublin

Seventh Framework Programme","Final"
"Cuturi M., Vert J.-P.","The context-tree kernel for strings",2005,26,"https://www.scopus.com/inward/record.uri?eid=2-s2.0-23244459989&doi=10.1016%2fj.neunet.2005.07.010&partnerID=40&md5=fed1db3bb32830c58b0f87a3bfb01f86","National Human Genome Research Institute

Japan Society for the Promotion of Science","Final"
"Supančič J.S., III, Rogez G., Yang Y., Shotton J., Ramanan D.","Depth-Based Hand Pose Estimation: Methods, Data, and Challenges",2018,25,"https://www.scopus.com/inward/record.uri?eid=2-s2.0-85045261450&doi=10.1007%2fs11263-018-1081-7&partnerID=40&md5=78afd9622b2219c4f6455006c57b650b","National Science Foundation

Office of Naval Research

European Commission","Final"
"Dupoux E.","Cognitive science in the era of artificial intelligence: A roadmap for reverse-engineering the infant language-learner",2018,25,"https://www.scopus.com/inward/record.uri?eid=2-s2.0-85044603935&doi=10.1016%2fj.cognition.2017.11.008&partnerID=40&md5=17e9439f183bc8340b81351ee8f23271","Seventh Framework Programme

European Research Council

Agence Nationale de la Recherche

Fondation de France","Final"
"Csépe Z., Makra L., Voukantsis D., Matyasovszky I., Tusnády G., Karatzas K., Thibaudon M.","Predicting daily ragweed pollen concentrations using Computational Intelligence techniques over two heavily polluted areas in Europe",2014,25,"https://www.scopus.com/inward/record.uri?eid=2-s2.0-84893475521&doi=10.1016%2fj.scitotenv.2014.01.056&partnerID=40&md5=5f0cedd182e70fda53475b1f0e0024b3","European Social Fund","Final"
"Urban C., Miné A.","A decision tree abstract domain for proving conditional termination",2014,25,"https://www.scopus.com/inward/record.uri?eid=2-s2.0-84921739162&doi=10.1007%2f978-3-319-10936-7_19&partnerID=40&md5=3070902438d1f5f651a045e64d0d0ab4","Seventh Framework Programme","Final"
"Sam V., Tai C.-H., Garnier J., Gibrat J.-F., Lee B., Munson P.J.","ROC and confusion analysis of structure comparison methods identify the main causes of divergence from manual protein classification",2006,25,"https://www.scopus.com/inward/record.uri?eid=2-s2.0-33746330397&doi=10.1186%2f1471-2105-7-206&partnerID=40&md5=fa698b990c926bb96524157a4787c603","National Cancer Institute","Final"
"Mohamad S., Sayed-Mouchaweh M., Bouchachia A.","Active learning for classifying data streams with unknown number of classes",2018,24,"https://www.scopus.com/inward/record.uri?eid=2-s2.0-85034033602&doi=10.1016%2fj.neunet.2017.10.004&partnerID=40&md5=9f104841745119b5f02575df2eb29c97","Horizon 2020 Framework Programme

European Commission

Horizon 2020","Final"
"Colledani M., (2), Battaïa O.","A decision support system to manage the quality of End-of-Life products in disassembly systems",2016,24,"https://www.scopus.com/inward/record.uri?eid=2-s2.0-84991000214&doi=10.1016%2fj.cirp.2016.04.121&partnerID=40&md5=cddde7376515e5d30474a9df4a234c03","Seventh Framework Programme","Final"
"Zou Q., Bornat Y., Tomas J., Renaud S., Destexhe A.","Real-time simulations of networks of Hodgkin-Huxley neurons using analog circuits",2006,24,"https://www.scopus.com/inward/record.uri?eid=2-s2.0-33748666223&doi=10.1016%2fj.neucom.2005.12.061&partnerID=40&md5=50ec58a5e0460aabea4f11ef2fed9bef","European Commission

Human Frontier Science Program

Centre National de la Recherche Scientifique","Final"
"Grégoire E., Konieczny S.","Logic-based approaches to information fusion",2006,24,"https://www.scopus.com/inward/record.uri?eid=2-s2.0-31144462529&doi=10.1016%2fj.inffus.2005.08.001&partnerID=40&md5=c3f105aea59b537bde2d992f1ea49191","European Regional Development Fund","Final"
"Rogez G., Weinzaepfel P., Schmid C.","LCR-Net++: Multi-Person 2D and 3D Pose Detection in Natural Images",2020,23,"https://www.scopus.com/inward/record.uri?eid=2-s2.0-85082991045&doi=10.1109%2fTPAMI.2019.2892985&partnerID=40&md5=84f084a8ef7be46188dbd615c8c1fa88","National Science Foundation

Seventh Framework Programme

European Research Council","Final"
"Ham B., Cho M., Schmid C., Ponce J.","Proposal Flow: Semantic Correspondences from Object Proposals",2018,23,"https://www.scopus.com/inward/record.uri?eid=2-s2.0-85023646116&doi=10.1109%2fTPAMI.2017.2724510&partnerID=40&md5=485fbe587982a566f61c808b1731904b","European Research Council

National Research Foundation of Korea

Ministry of Science ICT and Future Planning

Institut Universitaire de France","Final"
"De Dominicis M., Bruciaferri D., Gerin R., Pinardi N., Poulain P.M., Garreau P., Zodiatis G., Perivoliotis L., Fazioli L., Sorgente R., Manganiello C.","A multi-model assessment of the impact of currents, waves and wind in modelling surface drifters and oil spill",2016,23,"https://www.scopus.com/inward/record.uri?eid=2-s2.0-84965049968&doi=10.1016%2fj.dsr2.2016.04.002&partnerID=40&md5=c804a338067740bed4dee73f851d2111","Natural Environment Research Council

European Regional Development Fund","Final"
"Guidi A., Salvi S., Ottaviano M., Gentili C., Bertschy G., de Rossi D., Scilingo E.P., Vanello N.","Smartphone application for the analysis of prosodic features in running speech with a focus on bipolar disorders: System performance evaluation and case study",2015,23,"https://www.scopus.com/inward/record.uri?eid=2-s2.0-84946605577&doi=10.3390%2fs151128070&partnerID=40&md5=06bf40c997fa95a312ede03602cfc753","Seventh Framework Programme","Final"
"Congedo M., Afsari B., Barachant A., Moakher M.","Approximate joint diagonalization and geometric mean of symmetric positive definite matrices",2015,23,"https://www.scopus.com/inward/record.uri?eid=2-s2.0-84928816305&doi=10.1371%2fjournal.pone.0121423&partnerID=40&md5=efb7a479f2cb52d412518eda7864e891","Seventh Framework Programme","Final"
"Tamani N., Mosse P., Croitoru M., Buche P., Guillard V., Guillaume C., Gontard N.","An argumentation system for eco-efficient packaging material selection",2015,23,"https://www.scopus.com/inward/record.uri?eid=2-s2.0-84924417998&doi=10.1016%2fj.compag.2015.02.012&partnerID=40&md5=c364be95eecd4314c69e75a7902b84c3","Seventh Framework Programme

Seventh Framework Programme","Final"
"Guillard V., Buche P., Destercke S., Tamani N., Croitoru M., Menut L., Guillaume C., Gontard N.","A Decision Support System to design modified atmosphere packaging for fresh produce based on a bipolar flexible querying approach",2015,23,"https://www.scopus.com/inward/record.uri?eid=2-s2.0-84921031926&doi=10.1016%2fj.compag.2014.12.010&partnerID=40&md5=b4297f9a70e28cb9e1945696d1caee83","Seventh Framework Programme","Final"
"Paolini E., Fossorier M.P.C., Chiani M.","Doubly-generalized LDPC codes: Stability bound over the BEC",2009,23,"https://www.scopus.com/inward/record.uri?eid=2-s2.0-62749177487&doi=10.1109%2fTIT.2008.2011446&partnerID=40&md5=da0c2d1b9fb431f8f963a1f8d6b32106","Seventh Framework Programme

European Commission

Seventh Framework Programme","Final"
"Yuan Y., Zhang R., Hu R., Ruan X.","Prediction of CCR5 receptor binding affinity of substituted 1-(3,3-diphenylpropyl)-piperidinyl amides and ureas based on the heuristic method, support vector machine and projection pursuit regression",2009,23,"https://www.scopus.com/inward/record.uri?eid=2-s2.0-57949085600&doi=10.1016%2fj.ejmech.2008.03.004&partnerID=40&md5=f4258f9b7a5a214cf2ebdf2b39cceb9f","National Natural Science Foundation of China","Final"
"Rudolph M., Destexhe A.","How much can we trust neural simulation strategies?",2007,23,"https://www.scopus.com/inward/record.uri?eid=2-s2.0-34247513381&doi=10.1016%2fj.neucom.2006.10.138&partnerID=40&md5=4a5ec78aea20a7d46a3e2cde0b7810fb","European Commission

Centre National de la Recherche Scientifique","Final"
"Ames C.P., Smith J.S., Pellisé F., Kelly M., Alanay A., Acaroǧlu E., Pérez-Grueso F.J.S., Kleinstück F., Obeid I., Vila-Casademunt A., Burton D., Lafage V., Schwab F., Shaffrey C.I., Bess S., Serra-Burriel M.","Artificial Intelligence Based Hierarchical Clustering of Patient Types and Intervention Categories in Adult Spinal Deformity Surgery: Towards a New Classification Scheme that Predicts Quality and Value",2019,22,"https://www.scopus.com/inward/record.uri?eid=2-s2.0-85065059857&doi=10.1097%2fBRS.0000000000002974&partnerID=40&md5=1dd390b2f7d240b035fc8e2eb0608633","DePuy Synthes Spine

European Commission

Instituto de Salud Carlos III","Final"
"Aly A., Griffiths S., Stramandinoli F.","Metrics and benchmarks in human-robot interaction: Recent advances in cognitive robotics",2017,22,"https://www.scopus.com/inward/record.uri?eid=2-s2.0-84994575929&doi=10.1016%2fj.cogsys.2016.06.002&partnerID=40&md5=e531e649d2878b2739369163c8c34886","Seventh Framework Programme","Final"
"Mesejo P., Ibáñez O., Fernández-Blanco E., Cedrón F., Pazos A., Porto-Pazos A.B.","Artificial Neuron-Glia Networks learning approach based on cooperative coevolution",2015,22,"https://www.scopus.com/inward/record.uri?eid=2-s2.0-84929944667&doi=10.1142%2fS0129065715500124&partnerID=40&md5=7123e87a785da949a78058122e832f7f","Seventh Framework Programme

European Commission

Ministerio de Economía y Competitividad

Ministerio de Industria, Energía y Turismo","Final"
"Rizzo D., Martin L., Wohlfahrt J.","Miscanthus spatial location as seen by farmers: Amachine learning approach to model real criteria",2014,22,"https://www.scopus.com/inward/record.uri?eid=2-s2.0-84901636677&doi=10.1016%2fj.biombioe.2014.02.035&partnerID=40&md5=de9b795e4c6a92c07009f7f0e8a72916","Seventh Framework Programme

European Commission

Seventh Framework Programme

Muséum National d'Histoire Naturelle","Final"
"Hannagan T., Grainger J.","Protein Analysis Meets Visual Word Recognition: A Case for String Kernels in the Brain",2012,22,"https://www.scopus.com/inward/record.uri?eid=2-s2.0-84860580513&doi=10.1111%2fj.1551-6709.2012.01236.x&partnerID=40&md5=6b5c5e9556ff1a19a59f7ddc3c6483ff","Seventh Framework Programme","Final"
"Li X., Dai X., Dezert J., Smarandache F.","Fusion of imprecise qualitative information",2010,22,"https://www.scopus.com/inward/record.uri?eid=2-s2.0-78149282412&doi=10.1007%2fs10489-009-0170-2&partnerID=40&md5=89cc8428910da07d3ca9b3c342f0d93c","National Natural Science Foundation of China","Final"
"Kolodziejczyk T., Toscano R., Fouvry S., Morales-Espejel G.","Artificial intelligence as efficient technique for ball bearing fretting wear damage prediction",2010,22,"https://www.scopus.com/inward/record.uri?eid=2-s2.0-72149111667&doi=10.1016%2fj.wear.2009.08.016&partnerID=40&md5=e5adbd7d0c71912a6333942db7b5be28","European Commission","Final"
"Ibáñez R., Abisset-Chavanne E., González D., Duval J.-L., Cueto E., Chinesta F.","Hybrid constitutive modeling: data-driven learning of corrections to plasticity models",2019,21,"https://www.scopus.com/inward/record.uri?eid=2-s2.0-85055499729&doi=10.1007%2fs12289-018-1448-x&partnerID=40&md5=6b5133e7914542a6584dd8dc0f77e101","European Social Fund","Final"
"Vinod P., Zemmari A., Conti M.","A machine learning based approach to detect malicious android apps using discriminant system calls",2019,21,"https://www.scopus.com/inward/record.uri?eid=2-s2.0-85058234183&doi=10.1016%2fj.future.2018.11.021&partnerID=40&md5=39a6c7be38a8992b72def8d4631d094d","Deutscher Akademischer Austauschdienst

European Commission","Final"
"Chen Y., Zhang G., Jin T., Wu S., Peng B.","Quantitative modelling of electricity consumption using computational intelligence aided design",2014,21,"https://www.scopus.com/inward/record.uri?eid=2-s2.0-84897465600&doi=10.1016%2fj.jclepro.2014.01.058&partnerID=40&md5=5cbbb488c1870aba76fb72fb41c6e848","National Natural Science Foundation of China","Final"
"Windridge D., Shaukat A., Hollnagel E.","Characterizing driver intention via hierarchical perception-action modeling",2013,21,"https://www.scopus.com/inward/record.uri?eid=2-s2.0-84893051781&doi=10.1109%2fTSMCA.2012.2216868&partnerID=40&md5=20006a6f95b3234fc3ab191cf28a437f","Seventh Framework Programme

Engineering and Physical Sciences Research Council","Final"
"Santoro F., Tonino M., Torresan S., Critto A., Marcomini A.","Involve to improve: A participatory approach for a Decision Support System for coastal climate change impacts assessment. The North Adriatic case",2013,20,"https://www.scopus.com/inward/record.uri?eid=2-s2.0-84876484268&doi=10.1016%2fj.ocecoaman.2013.03.008&partnerID=40&md5=962bad1bf51f28eda74de252fcf9714a","Seventh Framework Programme

Centro Euro-Mediterraneo sui Cambiamenti Climatici","Final"
"Panagopoulos A., Wang C., Samaras D., Paragios N.","Simultaneous cast shadows, illumination and geometry inference using hypergraphs",2013,20,"https://www.scopus.com/inward/record.uri?eid=2-s2.0-84871767528&doi=10.1109%2fTPAMI.2012.110&partnerID=40&md5=f0feb6e58d97b47b1e7bf4dfc8d9f52a","National Science Foundation

National Institute on Drug Abuse

National Institute of Biomedical Imaging and Bioengineering

Seventh Framework Programme","Final"
"Lang J., Liberatore P., Marquis P.","Conditional independence in propositional logic",2002,20,"https://www.scopus.com/inward/record.uri?eid=2-s2.0-0036784220&doi=10.1016%2fS0004-3702%2802%2900244-8&partnerID=40&md5=80f81e54f9ecf8cee1166c9d1e33d701","European Regional Development Fund","Final"
"Pan Y., Wu D., Luo C., Dolgui A.","User activity measurement in rating-based online-to-offline (O2O) service recommendation",2019,19,"https://www.scopus.com/inward/record.uri?eid=2-s2.0-85057625464&doi=10.1016%2fj.ins.2018.11.009&partnerID=40&md5=3553a27850afad811ac5168c3f3ff93c","National Natural Science Foundation of China

Chinese Academy of Sciences

Ministry of Science and Technology of the People's Republic of China","Final"
"Vayron R., Nguyen V.-H., Lecuelle B., Lomami H.A., Meningaud J.-P., Bosc R., Haiat G.","Comparison of resonance frequency analysis and of quantitative ultrasound to assess dental implant osseointegration",2018,19,"https://www.scopus.com/inward/record.uri?eid=2-s2.0-85046628660&doi=10.3390%2fs18051397&partnerID=40&md5=dda62b42f6713d76eb45c2746fe2a0b4","Horizon 2020 Framework Programme

European Research Council

Agence Nationale de la Recherche

Horizon 2020","Final"
"Andries M., Simonin O., Charpillet F.","Localization of Humans, Objects, and Robots Interacting on Load-Sensing Floors",2016,19,"https://www.scopus.com/inward/record.uri?eid=2-s2.0-84962355423&doi=10.1109%2fJSEN.2015.2493122&partnerID=40&md5=303a6dd7ec23d31d9feded1516c1e3ed","Seventh Framework Programme","Final"
"Euzenat J.","Revision in networks of ontologies",2015,19,"https://www.scopus.com/inward/record.uri?eid=2-s2.0-84939551286&doi=10.1016%2fj.artint.2015.07.007&partnerID=40&md5=b2c4cb20f2dd74b223fb835b7f393276","European Commission","Final"
"Doniec A., Mandiau R., Piechowiak S., Espié S.","Anticipation based on constraint processing in a multi-agent context",2008,19,"https://www.scopus.com/inward/record.uri?eid=2-s2.0-51649123701&doi=10.1007%2fs10458-008-9048-7&partnerID=40&md5=8b4ac0420151dbc8c2f31e41018c1fcb","Centre National de la Recherche Scientifique

European Commission","Final"
"Zhao C., Zhang H., Zhang X., Zhang R., Luan F., Liu M., Hu Z., Fan B.","Prediction of milk/plasma drug concentration (M/P) ratio using support vector machine (SVM) method",2006,19,"https://www.scopus.com/inward/record.uri?eid=2-s2.0-32244431564&doi=10.1007%2fs11095-005-8716-4&partnerID=40&md5=e3ea55445b8869670ad5f8ec585cc64c","National Natural Science Foundation of China","Final"
"Perronnin F., Dugelay J.-L., Rose K.","A probabilistic model of face mapping with local transformations and its application to person recognition",2005,19,"https://www.scopus.com/inward/record.uri?eid=2-s2.0-22944467144&doi=10.1109%2fTPAMI.2005.130&partnerID=40&md5=fa274903ad4806e3e1e43c0e29639b59","National Science Foundation

University of California","Final"
"Hüllermeier E.","Similarity-based inference as evidential reasoning",2001,19,"https://www.scopus.com/inward/record.uri?eid=2-s2.0-0343832235&doi=10.1016%2fS0888-613X%2800%2900062-1&partnerID=40&md5=fbc65ff4f3950b08388b678294a88241","European Commission","Final"
