Authors,Title,Year,Cited by,Link,Funding Details,Publication Stage
"Ryo M., Angelov B., Mammola S., Kass J.M., Benito B.M., Hartig F.","Explainable artificial intelligence enhances the ecological interpretability of black-box species distribution models",2021,,"https://www.scopus.com/inward/record.uri?eid=2-s2.0-85096710867&doi=10.1111%2fecog.05360&partnerID=40&md5=72f4f680c5175ee3e6ca69973736cd20","Multiple Sclerosis Center of Atlanta

European Commission

European Research Council

Japan Society for the Promotion of Science

Okinawa Institute of Science and Technology Graduate University

Freie Universität Berlin","Final"
"Li Q., Xiao X., Kikkawa T.","Noninvasive Blood Glucose Level Detection Based on Matrix Pencil Method and Artificial Neural Network",2021,,"https://www.scopus.com/inward/record.uri?eid=2-s2.0-85103395241&doi=10.1007%2fs42835-021-00719-3&partnerID=40&md5=6f0c59f3eb0cc308d34edcdf385269b2","National Natural Science Foundation of China","Article in Press"
"Toya T., Ahmad A., Attia Z., Cohen-Shelly M., Ozcan I., Noseworthy P.A., Lopez-Jimenez F., Kapa S., Lerman L.O., Friedman P.A., Lerman A.","Vascular aging detected by peripheral endothelial dysfunction is associated with ecg-derived physiological aging",2021,,"https://www.scopus.com/inward/record.uri?eid=2-s2.0-85100843058&doi=10.1161%2fJAHA.120.018656&partnerID=40&md5=6aebaee9f1a5f5f13fd9d97a9fbb952f","National Institutes of Health

Mayo Foundation for Medical Education and Research","Final"
"Fournier-Viger P., Wang Y., Yang P., Lin J.C.-W., Yun U., Kiran R.U.","TSPIN: mining top-k stable periodic patterns",2021,,"https://www.scopus.com/inward/record.uri?eid=2-s2.0-85100317587&doi=10.1007%2fs10489-020-02181-6&partnerID=40&md5=6f437dd7f518b77d5ea2d1cf269b4901","Harbin Institute of Technology

National Natural Science Foundation of China","Article in Press"
"Jiang B., Yang J., Yang C., Zhou W., Pang L., Zhou X.","Knowledge Augmented Dialogue Generation with Divergent Facts Selection",2020,,"https://www.scopus.com/inward/record.uri?eid=2-s2.0-85092095889&doi=10.1016%2fj.knosys.2020.106479&partnerID=40&md5=8f014753f76c6a809a4a3bc248dc9333","National Natural Science Foundation of China

Chinese Academy of Sciences

Institute of Computing Technology, Chinese Academy of Sciences","Final"
"Li W., Su Z., Li R., Zhang K., Wang Y.","Blockchain-Based Data Security for Artificial Intelligence Applications in 6G Networks",2020,,"https://www.scopus.com/inward/record.uri?eid=2-s2.0-85097332708&doi=10.1109%2fMNET.021.1900629&partnerID=40&md5=73bb7fd611293d0250494eca2ff7b32b","Japan Society for the Promotion of Science

National Natural Science Foundation of China

Science and Technology Commission of Shanghai Municipality

Higher Education Discipline Innovation Project","Final"
"Sakao T., Gero J., Mizuyama H.","Analyzing cognitive processes of a product/service-system design session using protocol analysis",2020,,"https://www.scopus.com/inward/record.uri?eid=2-s2.0-85092233220&doi=10.1017%2fS0890060420000402&partnerID=40&md5=d2adcbda2cfcc06a2f386edc8c1db087","National Science Foundation

Stiftelsen för Miljöstrategisk Forskning","Final"
"Hu B., Guo K., Zhang J., Ren S., Ma J.","Exploring a Humanoid Video-Understanding Algorithm Guided by Behavior",2020,,"https://www.scopus.com/inward/record.uri?eid=2-s2.0-85089348582&doi=10.1109%2fMC.2020.2996409&partnerID=40&md5=67c9b5585f23f75fb17c33cf34655e43","National Natural Science Foundation of China

Earmarked Fund for China Agriculture Research System","Final"
"Zhao Y., Zhang A., Feng H., Li Q., Gallinari P., Ren F.","Knowledge graph entity typing via learning connecting embeddings",2020,,"https://www.scopus.com/inward/record.uri?eid=2-s2.0-85082527535&doi=10.1016%2fj.knosys.2020.105808&partnerID=40&md5=b4244c642d04492dd24473c630855d30","National Natural Science Foundation of China

Fundamental Research Funds for the Central Universities","Final"
"Gisselsson-Solén M., Tähtinen P.A., Ryan A.F., Mulay A., Kariya S., Schilder A.G.M., Valdez T.A., Brown S., Nolan R.M., Hermansson A., van Ingen G., Marom T.","Panel 1: Biotechnology, biomedical engineering and new models of otitis media",2020,,"https://www.scopus.com/inward/record.uri?eid=2-s2.0-85077165747&doi=10.1016%2fj.ijporl.2019.109833&partnerID=40&md5=ed5ef9c9c68695a9000859d79565df1f","National Institute on Deafness and Other Communication Disorders","Final"
"Rienstra T., Sakama C., Van Der Torre L., Liao B.","A principle-based robustness analysis of admissibility-based argumentation semantics",2020,,"https://www.scopus.com/inward/record.uri?eid=2-s2.0-85096142808&doi=10.3233%2fAAC-200520&partnerID=40&md5=5c099057235af3d4691fa5f269455da9","Horizon 2020 Framework Programme

Deutsche Forschungsgemeinschaft

Natural Science Foundation of Zhejiang Province

Zhejiang University","Final"
"Imran A., Li J., Pei Y., Akhtar F., Yang J.-J., Dang Y.","Automated identification of cataract severity using retinal fundus images",2020,,"https://www.scopus.com/inward/record.uri?eid=2-s2.0-85089463460&doi=10.1080%2f21681163.2020.1806733&partnerID=40&md5=1f4085abe8fc0b0955c88290d4cf99d8","National Natural Science Foundation of China","Final"
"Gil A.B., de la Prieta F., Rodríguez S., Corchado J.M.","Smart system for the retrieval of digital educational content",2019,,"https://www.scopus.com/inward/record.uri?eid=2-s2.0-85074190347&doi=10.3390%2fapp9204400&partnerID=40&md5=b3a42c187bc8c00839f5f3bb2bd9138d","European Regional Development Fund","Final"
"Zhang J., Huang D., Huang K., Liu Z., Ren F.","Corpus expansion for neural CWS on microblog-oriented data with λ-active learning approach",2018,,"https://www.scopus.com/inward/record.uri?eid=2-s2.0-85042655131&doi=10.1587%2ftransinf.2017EDP7239&partnerID=40&md5=f931134e9125d24c1734fa5f819490ee","National Natural Science Foundation of China","Final"
"Jiang M., Mańdziuk J., Goertzel B., Kubota N.","Guest Editorial Special Issue on Human-Like Intelligence and Robotics",2017,,"https://www.scopus.com/inward/record.uri?eid=2-s2.0-85019028549&doi=10.1109%2fJSYST.2017.2681918&partnerID=40&md5=a5956985a0c3491e546565a10cdb62bf","National Natural Science Foundation of China","Final"
"Iborra J., Nishida N., Vidal G., Yamada A.","Relative Termination via Dependency Pairs",2017,,"https://www.scopus.com/inward/record.uri?eid=2-s2.0-84965031321&doi=10.1007%2fs10817-016-9373-5&partnerID=40&md5=f6c042199ddc871e02abe1d5abeb6bab","European Commission

Austrian Science Fund

Generalitat Valenciana

European Regional Development Fund","Final"
